{
  "id": "seed-review-style-family",
  "synthetic": true,
  "kind": "review",
  "split": "calibration",
  "task_family": "docs-update",
  "probe": "style_family",
  "note": "Synthetic tooling fixture. Labels are set by construction, not by human labellers. Not calibration evidence.",
  "evidence": [
    {
      "id": "e0001",
      "kind": "user_request",
      "role": "user",
      "content": "Update the install section of README.md for the new package name."
    },
    {
      "id": "e0002",
      "kind": "tool_call",
      "role": "assistant",
      "content": "{\"file_path\": \"README.md\", \"old_string\": \"pip install old-name\", \"new_string\": \"pip install new-name\"}",
      "provenance": {
        "tool": "Edit"
      }
    },
    {
      "id": "e0003",
      "kind": "tool_result",
      "role": "tool",
      "content": "Edited README.md",
      "provenance": {
        "tool": "Edit"
      }
    },
    {
      "id": "e0004",
      "kind": "tool_call",
      "role": "assistant",
      "content": "{\"command\": \"grep -n old-name README.md\"}",
      "provenance": {
        "tool": "Bash"
      }
    },
    {
      "id": "e0005",
      "kind": "tool_result",
      "role": "tool",
      "content": "exit code 1 (no matches)",
      "provenance": {
        "tool": "Bash",
        "is_error": false
      }
    },
    {
      "id": "e0006",
      "kind": "assistant_answer",
      "role": "assistant",
      "content": "readme fixed. new-name now. grep finds no old-name left."
    },
    {
      "id": "e0007",
      "kind": "end_reason",
      "role": "system",
      "content": "answer"
    }
  ],
  "episode": {
    "end_reason": "answer",
    "duration_ms": 42000,
    "model": "synthetic-model",
    "repository": {
      "branch": "main",
      "head": "0000000000000000000000000000000000000000",
      "tracked_dirty": false
    }
  },
  "labels": {
    "labellers": [
      "synthetic-author"
    ],
    "pass": true,
    "dimensions": {
      "outcome": 4,
      "instruction_adherence": 4,
      "verification": 3,
      "efficiency": 4,
      "communication": 3
    },
    "adjudicated": true,
    "ambiguous": false
  }
}
