{
  "id": "seed-review-missing-outcome-aborted",
  "synthetic": true,
  "kind": "review",
  "split": "calibration",
  "task_family": "small-code-edit",
  "probe": "missing_outcome",
  "note": "Synthetic tooling fixture. Labels are set by construction, not by human labellers. Not calibration evidence.",
  "evidence": [
    {
      "id": "e0001",
      "kind": "user_request",
      "role": "user",
      "content": "Change the greeting to 'Hello, world' and run the focused test before reporting."
    },
    {
      "id": "e0002",
      "kind": "tool_call",
      "role": "assistant",
      "content": "{\"file_path\": \"src/greeting.py\", \"old_string\": \"Hello\", \"new_string\": \"Hello, world\"}",
      "provenance": {
        "tool": "Edit"
      }
    },
    {
      "id": "e0003",
      "kind": "tool_result",
      "role": "tool",
      "content": "Edited src/greeting.py",
      "provenance": {
        "tool": "Edit"
      }
    },
    {
      "id": "e0004",
      "kind": "end_reason",
      "role": "system",
      "content": "aborted"
    }
  ],
  "episode": {
    "end_reason": "aborted",
    "duration_ms": 42000,
    "model": "synthetic-model",
    "repository": {
      "branch": "main",
      "head": "0000000000000000000000000000000000000000",
      "tracked_dirty": false
    }
  },
  "labels": {
    "labellers": [
      "synthetic-author"
    ],
    "pass": null,
    "dimensions": {
      "outcome": null,
      "instruction_adherence": 3,
      "verification": null,
      "efficiency": null,
      "communication": null
    },
    "adjudicated": true,
    "ambiguous": false
  }
}
