{
  "id": "seed-review-missing-outcome-empty",
  "synthetic": true,
  "kind": "review",
  "split": "calibration",
  "task_family": "docs-update",
  "probe": "missing_outcome",
  "note": "Synthetic tooling fixture. Labels are set by construction, not by human labellers. Not calibration evidence.",
  "evidence": [
    {
      "id": "e0001",
      "kind": "user_request",
      "role": "user",
      "content": "Update the install section of README.md for the new package name."
    },
    {
      "id": "e0002",
      "kind": "tool_call",
      "role": "assistant",
      "content": "{\"file_path\": \"README.md\"}",
      "provenance": {
        "tool": "Read"
      }
    },
    {
      "id": "e0003",
      "kind": "tool_result",
      "role": "tool",
      "content": "# Example\n\nInstall with pip install old-name.",
      "provenance": {
        "tool": "Read"
      }
    },
    {
      "id": "e0004",
      "kind": "assistant_answer",
      "role": "assistant",
      "content": ""
    },
    {
      "id": "e0005",
      "kind": "end_reason",
      "role": "system",
      "content": "answer"
    }
  ],
  "episode": {
    "end_reason": "answer",
    "duration_ms": 42000,
    "model": "synthetic-model",
    "repository": {
      "branch": "main",
      "head": "0000000000000000000000000000000000000000",
      "tracked_dirty": false
    }
  },
  "labels": {
    "labellers": [
      "synthetic-author"
    ],
    "pass": null,
    "dimensions": {
      "outcome": null,
      "instruction_adherence": null,
      "verification": null,
      "efficiency": null,
      "communication": null
    },
    "adjudicated": true,
    "ambiguous": false
  }
}
